{
    "$schema": "https://json-schema.org/draft-07/schema",
    "title": "script.json",
    "type": "object",
    "properties": {
        "name": {
            "description": "The name of the script as it will appear on Roll20.",
            "type": "string"
        },
        "script": {
            "description": "The name of the JavaScript file, which must remain uniform throughout versions.",
            "type": "string"
        },
        "version": {
            "description": "The current version number of the script.",
            "type": "string"
        },
        "previousversions": {
            "description": "All previous versions of the script in an array format.",
            "type": "array",
            "items": {
                "description": "Previous version of the script.",
                "type": "string"
            },
            "uniqueItems": true
        },
        "description": {
            "description": "A short explanation of the script and it's use that will appear along side the script on Roll20.",
            "type": "string"
        },
        "authors": {
            "description": "A simple string telling who contributed toward the script.",
            "type": "string"
        },
        "roll20userid": {
            "description": "A simple string telling the Roll20 User ID's of the authors. Used internally and won't be shown publicly on the site.",
            "type": "string"
        },
        "useroptions": {
            "description": "An array of hashes that allow script authors to set pre-determined options for users to customize the functionality of the script.",
            "type": "array",
            "items": {
                "description": "Hash that allow script authors to set pre-determined an option for users to customize the functionality of the script.",
                "type": "object",
                "properties": {
                    "name": {
                        "type": "string"
                    },
                    "type": {
                        "type": "string",
                        "enum": [ "text", "number", "select", "checkbox" ]
                    },
                    "default": {
                        "type": "string"
                    },
                    "description": {
                        "type": "string"
                    }
                }
            },
            "uniqueItems": true
        },
        "dependencies": {
            "description": "A list of other scripts this script requires to function.",
            "type": "array",
            "items": {
                "description": "Another script this script requires to function.",
                "type": "string"
            },
            "uniqueItems": true
        },
        "modifies": {
            "description": "A list of the common Roll20 objects and properties the script reads and writes to.",
            "type": "object",
            "additionalProperties" : {
                "description": "A common Roll20 object or property the script reads and/or writes to.",
                "type": "string",
                "enum": [ "read", "write", "read,write" ]
            }
        },
        "conflicts": {
            "description": "A list of other scripts this script is known to conflict with.",
            "type": "array",
            "items": {
                "description": "Anther script this script is known to conflict with.",
                "type": "string"
            }
        }
    },
    "required": [ "name", "script", "previousversions", "description", "authors", "roll20userid", "useroptions", "dependencies", "modifies", "conflicts" ]
}