{
    "name": "Ez Exhaust 2024",
    "script": "EzExhaust2024.js",
    "version": "1.0",
    "previousversions": [],
    "description": "Provides GMs and Players with a simple method for applying, and managing Exhaustion within the 5E 2024 ruleset.",
    "authors": "Kahooty.",
    "roll20userid": "14337689",
    "useroptions": [],
    "dependencies": [],
    "modifies": {},
    "conflicts": []
}