{
    "name": "ShareVision",
    "script": "ShareVision.js",
    "version": "1.4",
    "previousversions": [],
    "description": "ShareVision allows you to share a token's sight with the whole party. Use the aura status marker to share normal vision and the overdrive status marker to share darkvision.",
    "authors": "Scott C.",
    "roll20userid": "459831",
    "useroptions": [],
    "dependencies": [],
    "modifies": {
        "state.ShareVision.version": "read,write",
        "token.statusmarker": "read,write"
    },
    "conflicts": []
}
