{
    "name": "Cypher Systems by Roll20 Companion",
    "script": "cypher_systems_by_roll20.js",
    "version": "1.1.0",
    "previousversions": ["1.001"],
    "description": "Designed for the \"Cypher Systems by Roll20\" character sheet. Enables application of stat costs, recovery rolls, and damage to characters and NPCs from the chat roll template.",
    "authors": "Natha",
    "roll20userid": "75857",
    "useroptions": [],
    "dependencies": [],
    "modifies": {},
    "conflicts": ["Natha's Numenera","Cypher System Sheet"]
}