{
    "$schema": "https://github.com/DameryDad/roll20-api-scripts/blob/MagicMaster/MagicMaster/Script.json",
    "name": "MagicMaster",
    "script": "MagicMaster.js",
    "version": "5.4.2",
    "previousversions": ["2.044","2.045","2.046","2.048","3.051","1.3.00","1.3.01","1.3.02","1.3.03","1.4.01","1.4.02","1.4.04","1.4.05","1.4.06","1.4.07","1.5.01","1.5.02","1.5.03","2.1.0","2.1.1","2.2.0","2.2.1","2.3.0","2.3.1","2.3.2","2.3.3","2.3.4","3.0.0","3.1.2","3.2.0","3.2.1","3.3.0","3.4.0","3.5.0","3.5.1","4.0.1","4.0.2","4.0.3","4.0.4","4.0.5","4.0.6","5.0.0","5.0.1","5.0.2","5.0.3","5.3.0"],
    "description": "The MagicMaster API provides functions to manage all types of magic, including:\n* Wizard & Priest spell use and effects;\n* Character, NPC & Monster Powers; \n* discovery, looting, use and cursing of Magic Items;\n\n[MagicMaster Documentation](https://wiki.roll20.net/Script:MagicMaster) \n### Installation\nLoading MagicMaster via One-Click also loads the rest of the RPGMaster series of APIs \n[RPGMaster Documentation](https://wiki.roll20.net/RPGMaster) \n### Getting Started\n1. Ensure the CommandMaster API is also installed\n2. Run the CommandMaster `!cmd --initialise` command and add the player macros created to the Macro Bar, then\n3. Select tokens and use the `Token Setup` macro bar button just created to add all relevant Action Buttons to the token(s) (plus set the tokens/Characters up in any other way provided in the menu displayed)\n\n### Use In Play\nOnce the Getting Started steps have been done, the players and DM can then use the buttons displayed at the top of the screen when their character's token is selected to perform all actions needed in normal play.",
    "authors": "Richard E.",
    "roll20userid": "6497708",
    "useroptions": [],
    "dependencies": ["ChatSetAttr","Tokenmod","RoundMaster","RPGMaster library AD+D2e","InitMaster","AttackMaster"],
    "modifies": {
        "state.MagicMaster": "read,write",
		"player.online": "read",
		"character.id": "read",
		"character.name": "read",
		"character.controlledby": "read",
        "token.bar1_link": "read",
        "token.bar2_link": "read",
        "token.bar3_link": "read",
        "token.bar1_value": "read,write",
        "token.bar2_value": "read,write",
        "token.bar3_value": "read,write",
        "token.bar1_max": "read,write",
        "token.bar2_max": "read,write",
        "token.bar3_max": "read,write",
		"token.id": "read",
		"token.pageid": "read",
		"token.represents": "read",
		"token.name": "read",
		"token.aura2_radius": "read,write",
		"token.aura2_color": "read,write",
		"token.aura2_square": "read,write",
		"attribute.id": "read",
		"attribute.characterid": "read",
		"attribute.name": "read,write",
		"attribute.current": "read,write",
		"attribute.max": "read,write",
		"ability.id": "read",
		"ability.characterid": "read",
		"ability.name": "read,write",
		"ability.action": "read",
		"handout.id": "read,write",
		"handout.name": "read,write",
		"handout.notes": "write",
		"handout.inplayerjournals": "write"
    },
    "conflicts": []
}
