{
"name": "DealInit",
"script":"Deal-Init.js",	
"version": "1.3",
"previousversions": [ 
    "1.2"
],
"description": "Handles Savage Worlds card-based Inititive by dealing cards to Turn Order, automatically handling Jokers and Initiative Edges and sorting Turn Order by suit.",
"authors": "Pat Elwer",
"roll20userid": "8948",
"useroptions": [
    {
      "name": "Use Initiative Deck with 4 Jokers",
      "type": "checkbox",
      "description": "Select this option to add 2 extra Jokers to your Initiative Deck.",
      "value": "use4Jokers"
    }
  ],
"dependencies": [],
"modifies": {
	"character.": "read",
	"token.*": "read",
	"turnorder.*": "read,write"
	},
"conflicts":[]
}
